{
  "schemaVersion": "1.0.0",
  "createdOn": "2026-10-26",
  "language": "zh-CN",
  "pageConvention": "pdfPages为原附件从1开始的物理页码，含封面、空白和目录；printedPages未逐项核对时为null。不得换用别版页码。",
  "coverage": {
    "reportedAttachments": 16,
    "accessibleBooks": 10,
    "missingAttachments": 6,
    "fullBooksRead": 0,
    "readingMode": "目录+书目信息+相关章节片段核读；非全文蒸馏、非模型训练",
    "pendingSlots": [
      {
        "slot": "U01",
        "status": "attachment_not_returned",
        "title": null,
        "reason": "原对话仅返回10个附件；不知道其余书名和内容，未生成知识卡。"
      },
      {
        "slot": "U02",
        "status": "attachment_not_returned",
        "title": null,
        "reason": "原对话仅返回10个附件；不知道其余书名和内容，未生成知识卡。"
      },
      {
        "slot": "U03",
        "status": "attachment_not_returned",
        "title": null,
        "reason": "原对话仅返回10个附件；不知道其余书名和内容，未生成知识卡。"
      },
      {
        "slot": "U04",
        "status": "attachment_not_returned",
        "title": null,
        "reason": "原对话仅返回10个附件；不知道其余书名和内容，未生成知识卡。"
      },
      {
        "slot": "U05",
        "status": "attachment_not_returned",
        "title": null,
        "reason": "原对话仅返回10个附件；不知道其余书名和内容，未生成知识卡。"
      },
      {
        "slot": "U06",
        "status": "attachment_not_returned",
        "title": null,
        "reason": "原对话仅返回10个附件；不知道其余书名和内容，未生成知识卡。"
      }
    ]
  },
  "sources": [
    {
      "id": "S01",
      "title": "Abnormal Psychology",
      "authors": "Ann M. Kring；Sheri L. Johnson；含 Gerald C. Davison、John M. Neale 早期贡献",
      "edition": "第12版，Wiley，2012",
      "originalFilename": "Abnormal psychology (Ann M. Kring, Sheri L. Johnson etc.) (z-library.sk, 1lib.sk, z-lib.sk)(2).pdf",
      "sha256": "17dd9960b56ee2bcb7350e5943ce40a61b176b0ac92667b84c69b52128b6452d",
      "pdfPageCount": 656,
      "status": "selected_sections_inspected",
      "bibliographyPages": [
        7,
        8
      ],
      "tocPages": [
        19,
        20
      ],
      "bodyPages": [
        28,
        29,
        30,
        31
      ],
      "visuallyCheckedPages": [
        19,
        29
      ],
      "inspectedScope": "第1章 Introduction and Historical Overview：stigma、定义边界",
      "limitations": "诊断内容面向2013年前后的分类讨论，不能作为现行诊断标准。",
      "unprocessedScope": "除列出的目录、书目信息和正文页外，其余正文尚未逐页核读；全文件文本提取不等于全文阅读。"
    },
    {
      "id": "S02",
      "title": "思考，快与慢",
      "authors": "丹尼尔·卡尼曼；胡晓姣、李爱民、何梦莹译",
      "edition": "中信出版社，2012年7月第1版",
      "originalFilename": "思考, 快与慢 = Thinking, Fast and Slow ([美] 丹尼尔 · 卡尼曼 (Daniel Kahneman) 著  李爱民 etc.) (z-library.sk, 1lib.sk, z-lib.sk)(5).pdf",
      "sha256": "7a02fc4856d9da88b07cff04b66ea9d8be0864acc2cab0cc68f6efcc7bf0bed5",
      "pdfPageCount": 515,
      "status": "selected_sections_inspected",
      "bibliographyPages": [
        2,
        3
      ],
      "tocPages": [
        6,
        7,
        8
      ],
      "bodyPages": [
        23,
        24,
        25,
        26,
        275,
        276,
        277,
        278
      ],
      "visuallyCheckedPages": [
        6,
        25
      ],
      "inspectedScope": "第1章 行为与注意力；第23章 内部意见与外部意见",
      "limitations": "叙述性综合；未核验书内每项原始研究或后续重复研究，避免把所有经典实验视为定论。",
      "unprocessedScope": "除列出的目录、书目信息和正文页外，其余正文尚未逐页核读；全文件文本提取不等于全文阅读。"
    },
    {
      "id": "S03",
      "title": "An Introduction to Brain and Behavior",
      "authors": "Bryan Kolb；Ian Q. Whishaw；G. Campbell Teskey",
      "edition": "第6版，Worth Publishers，2019",
      "originalFilename": "An Introduction to Brain and Behavior, 6th ed (Bryan Kolb, Ian Q. Whishaw etc.) (z-library.sk, 1lib.sk, z-lib.sk)(3).pdf",
      "sha256": "57f27d8b5f83303d3b99fdcf516d11057a1904aaf931f4d977c9b8033416bed5",
      "pdfPageCount": 2471,
      "status": "selected_sections_inspected",
      "bibliographyPages": [
        7,
        10
      ],
      "tocPages": [
        15,
        16,
        43,
        44
      ],
      "bodyPages": [
        1554,
        1555,
        1556,
        1557,
        1558,
        1559
      ],
      "visuallyCheckedPages": [
        44,
        1558
      ],
      "inspectedScope": "第13章 13-4 What Does Sleep Accomplish?：睡眠剥夺、睡眠与记忆",
      "limitations": "2471页为电子书重排；页面页脚1557不是纸书页码。动物与成人实验不可直接外推为儿童处方。",
      "unprocessedScope": "除列出的目录、书目信息和正文页外，其余正文尚未逐页核读；全文件文本提取不等于全文阅读。"
    },
    {
      "id": "S04",
      "title": "自卑与超越",
      "authors": "阿弗雷德·阿德勒；李青霞译",
      "edition": "沈阳出版社，2012.12",
      "originalFilename": "自卑与超越(经典完整译本) (阿弗雷德•阿德勒 [阿弗雷德•阿德勒]) (z-library.sk, 1lib.sk, z-lib.sk)(2).pdf",
      "sha256": "587022bd180ea0e4fbf44bf09f0ee896b040ccc4025acd64b3f6cd260e4a8883",
      "pdfPageCount": 273,
      "status": "selected_sections_inspected",
      "bibliographyPages": [
        2
      ],
      "tocPages": [
        6,
        7,
        8,
        9
      ],
      "bodyPages": [
        157,
        158,
        159
      ],
      "visuallyCheckedPages": [
        7,
        157
      ],
      "inspectedScope": "第7章 学校的影响：课堂里的合作与竞争",
      "limitations": "历史性个体心理学观点与案例；不采用家庭排行、梦、智商保密或责备儿童等为现代实证结论。",
      "unprocessedScope": "除列出的目录、书目信息和正文页外，其余正文尚未逐页核读；全文件文本提取不等于全文阅读。"
    },
    {
      "id": "S05",
      "title": "创伤与复原",
      "authors": "朱迪思·赫尔曼；施宏达、陈文琪译",
      "edition": "机械工业出版社，2015年纸版对应电子版",
      "originalFilename": "创伤与复原 = Trauma And Recovery The Aftermath Of Violence- From Domestic Abuse To Political Terror ([美] 朱迪思・赫尔曼 (Judith Herman) 著  施宏达, 陈文琪 译) (z-library.sk, 1lib.sk, z-lib.sk)(2).pdf",
      "sha256": "94aaf7e7b8610ffa93f1baee1da0a44eb598e02a1c42e2bc6b4baa2f8b074de8",
      "pdfPageCount": 408,
      "status": "selected_sections_inspected",
      "bibliographyPages": [
        2
      ],
      "tocPages": [
        4,
        5,
        6,
        7
      ],
      "bodyPages": [
        222,
        223,
        224,
        257,
        258,
        268,
        269
      ],
      "visuallyCheckedPages": [
        6,
        257
      ],
      "inspectedScope": "第7章 治疗关系/恢复自主权；第8章 安全/建立安全环境",
      "limitations": "专业创伤治疗语境，仅提炼教师安全原则；不在班会实施回顾创伤、暴露或治疗。",
      "unprocessedScope": "除列出的目录、书目信息和正文页外，其余正文尚未逐页核读；全文件文本提取不等于全文阅读。"
    },
    {
      "id": "S06",
      "title": "The Life Span: Human Development for Helping Professionals",
      "authors": "Patricia C. Broderick；Pamela Blewitt",
      "edition": "第6版，Pearson，版权页2025",
      "originalFilename": "The Life Span Human Development for Helping Professionals, SE, 6e (Patricia C. Broderick  Pamela Blewitt) (z-library.sk, 1lib.sk, z-lib.sk)(2).pdf",
      "sha256": "055f2ff98529a634721645673b7e4e7d8f46a822343f8a84cd99480d8cac37a5",
      "pdfPageCount": 815,
      "status": "selected_sections_inspected",
      "bibliographyPages": [
        4,
        5
      ],
      "tocPages": [
        7,
        8,
        10
      ],
      "bodyPages": [
        288,
        289,
        292,
        293
      ],
      "visuallyCheckedPages": [
        10,
        292
      ],
      "inspectedScope": "第7章 Self-Concept；Self-Esteem, Self-Efficacy, and Narcissism",
      "limitations": "多维发展与文化差异；年级适配是教学判断，不是年龄诊断或所有学生都相同的阶段。",
      "unprocessedScope": "除列出的目录、书目信息和正文页外，其余正文尚未逐页核读；全文件文本提取不等于全文阅读。"
    },
    {
      "id": "S07",
      "title": "Social Psychology",
      "authors": "Elliot Aronson；Timothy D. Wilson；Robin M. Akert",
      "edition": "第8版，Pearson Custom Library，2014；章节署2013",
      "originalFilename": "Social Psychology (8th Edition) (Elliot Aronson, Timothy D. Wilson) (z-library.sk, 1lib.sk, z-lib.sk)(2).pdf",
      "sha256": "a2ac08310fbe9775412254cbab0d5135337930777b15e6bc4e34f6076dd50523",
      "pdfPageCount": 543,
      "status": "selected_sections_inspected",
      "bibliographyPages": [
        1,
        2,
        3,
        6
      ],
      "tocPages": [
        4,
        5
      ],
      "bodyPages": [
        383,
        384,
        385,
        468,
        469,
        470
      ],
      "visuallyCheckedPages": [
        4,
        469
      ],
      "inspectedScope": "第11章 Prosocial Behavior；第13章 Prejudice/Jigsaw Classroom",
      "limitations": "本文件是Pearson定制编排。只概括已读机制；不采用未经复核的Genovese故事细节，不复制危险实验。",
      "unprocessedScope": "除列出的目录、书目信息和正文页外，其余正文尚未逐页核读；全文件文本提取不等于全文阅读。"
    },
    {
      "id": "S08",
      "title": "Research Methods for the Behavioural Sciences",
      "authors": "Frederick J. Gravetter；Lori-Ann B. Forzano；Tim Rakow改编",
      "edition": "第1版EMEA，Cengage，2021；改编自第6版",
      "originalFilename": "Research Methods For The Behavioural Sciences (Tim Rakow, Frederick Gravetter etc.) (z-library.sk, 1lib.sk, z-lib.sk)(2).pdf",
      "sha256": "7bfa89ebf122ee8765fdc21274a71e35974393de4728a105c5414240ceb381db",
      "pdfPageCount": 570,
      "status": "selected_sections_inspected",
      "bibliographyPages": [
        4
      ],
      "tocPages": [
        5,
        7,
        8,
        9,
        10
      ],
      "bodyPages": [
        75,
        76,
        77,
        78
      ],
      "visuallyCheckedPages": [
        8,
        77
      ],
      "inspectedScope": "第3章 3.1 Constructs and Operational Definitions",
      "limitations": "研究方法用于改进教学评价；自编课堂观察不具备临床量表的诊断效力。",
      "unprocessedScope": "除列出的目录、书目信息和正文页外，其余正文尚未逐页核读；全文件文本提取不等于全文阅读。"
    },
    {
      "id": "S09",
      "title": "Research Methods and Statistics in Psychology",
      "authors": "Hugh Coolican",
      "edition": "第6版，Psychology Press，2014",
      "originalFilename": "Research Methods and Statistics in Psychology (Hugh Coolican) (z-library.sk, 1lib.sk, z-lib.sk)(2).pdf",
      "sha256": "ba01aed45874f42d168651cf44cad69f66272ca81c1131418e960fc1a92e118a",
      "pdfPageCount": 788,
      "status": "selected_sections_inspected",
      "bibliographyPages": [
        4,
        5
      ],
      "tocPages": [
        8,
        9,
        10,
        11
      ],
      "bodyPages": [
        301,
        302,
        303,
        304
      ],
      "visuallyCheckedPages": [
        9,
        301
      ],
      "inspectedScope": "第11章 Ethical Issues：退出权、权力关系、隐私与非自愿参与",